{
  "subject": {
    "task_id": "dependency-upgrade-001",
    "title": "Apply a narrow axios patch upgrade with lockfile sync",
    "repository": "worktree",
    "intended_files": [
      "package.json",
      "package-lock.json",
      "tests/api-client.test.ts"
    ]
  },
  "builder": {
    "tool": "council",
    "version": "0.1.0"
  },
  "predicate_type": "https://consensuscouncilllm.local/attestation/patch-adjudication/v1",
  "predicate": {
    "winning_proposal_id": "proposal-b",
    "final_writer": "agent:release",
    "review_mode": "audit",
    "change_class": "dependency_upgrade",
    "risk_level": "medium"
  },
  "policy": {
    "policy_id": "dependency_upgrade_v1",
    "change_class": "dependency_upgrade",
    "risk_level": "medium"
  },
  "checks": {
    "required": [
      {
        "name": "tests",
        "status": "pass"
      },
      {
        "name": "dependency_audit",
        "status": "pass"
      }
    ],
    "optional": [
      {
        "name": "changelog_review",
        "status": "pass"
      }
    ]
  },
  "evidence_refs": [
    {
      "path": "evidence_graph.json",
      "sha256": null
    },
    {
      "path": "adjudication.json",
      "sha256": "ba832515e68a22d90f613e682b4ab669b3001287058f2b6b307f1eaea2d5b161"
    },
    {
      "path": "final_patch.diff",
      "sha256": "15fde7ae743ccc90949a9d4c1f59a0862cb9d0a36d2abae478d9d8b6ffdae467"
    },
    {
      "path": "worktree",
      "sha256": null
    },
    {
      "path": "review_summary.md",
      "sha256": "cd448b724db4dff09738f86c585377f9f9173599470d2f0103076b6adc9e0eb0"
    },
    {
      "path": "replay_record.json",
      "sha256": null
    }
  ],
  "human_witness": {
    "required": false,
    "status": "pending-human-approval"
  },
  "verification_status": "prototype-unverified-until-council-verify"
}